\set VERBOSITY terse
\pset format unaligned
-- predictability
SET synchronous_commit = on;
DROP TABLE IF EXISTS table_with_pk;
DROP TABLE IF EXISTS table_without_pk;
DROP TABLE IF EXISTS table_with_unique;
CREATE TABLE table_with_pk (
a	smallserial,
b	smallint,
c	int,
d	bigint,
e	numeric(5,3),
f	real not null,
g	double precision,
h	char(10),
i	varchar(30),
j	text,
k	bit varying(20),
l	timestamp,
m	date,
n	boolean not null,
o	json,
p	tsvector,
PRIMARY KEY(b, c, d)
);
CREATE TABLE table_without_pk (
a	smallserial,
b	smallint,
c	int,
d	bigint,
e	numeric(5,3),
f	real not null,
g	double precision,
h	char(10),
i	varchar(30),
j	text,
k	bit varying(20),
l	timestamp,
m	date,
n	boolean not null,
o	json,
p	tsvector
);
CREATE TABLE table_with_unique (
a	smallserial,
b	smallint,
c	int,
d	bigint,
e	numeric(5,3) not null,
f	real not null,
g	double precision not null,
h	char(10),
i	varchar(30),
j	text,
k	bit varying(20),
l	timestamp,
m	date,
n	boolean not null,
o	json,
p	tsvector,
UNIQUE(g, n)
);
-- INSERT
INSERT INTO table_with_pk (b, c, d, e, f, g, h, i, j, k, l, m, n, o, p) VALUES(1, 2, 3, 3.54, 876.563452345, 1.23, 'teste', 'testando', 'um texto longo', B'001110010101010', '2013-11-02 17:30:52', '2013-02-04', true, '{ "a": 123 }', 'Old Old Parr'::tsvector);
INSERT INTO table_with_pk (b, c, d, e, f, g, h, i, j, k, l, m, n, o, p) VALUES(4, 5, 6, 3.54, 876.563452345, 1.23, 'teste', 'testando', 'um texto longo', B'001110010101010', '2013-11-02 17:30:52', '2013-02-04', true, '{ "a": 123 }', 'Old Old Parr'::tsvector);
INSERT INTO table_without_pk (b, c, d, e, f, g, h, i, j, k, l, m, n, o, p) VALUES(1, 2, 3, 3.54, 876.563452345, 1.23, 'teste', 'testando', 'um texto longo', B'001110010101010', '2013-11-02 17:30:52', '2013-02-04', true, '{ "a": 123 }', 'Old Old Parr'::tsvector);
INSERT INTO table_with_unique (b, c, d, e, f, g, h, i, j, k, l, m, n, o, p) VALUES(1, 2, 3, 3.54, 876.563452345, 1.23, 'teste', 'testando', 'um texto longo', B'001110010101010', '2013-11-02 17:30:52', '2013-02-04', true, '{ "a": 123 }', 'Old Old Parr'::tsvector);
SELECT slot_create();
slot_create
init
(1 row)
-- DELETE: REPLICA IDENTITY FULL
ALTER TABLE table_with_pk REPLICA IDENTITY FULL;
DELETE FROM table_with_pk WHERE b = 1;
DELETE FROM table_with_pk WHERE n = true;
ALTER TABLE table_with_pk REPLICA IDENTITY DEFAULT;
ALTER TABLE table_without_pk REPLICA IDENTITY FULL;
DELETE FROM table_without_pk WHERE b = 1;
ALTER TABLE table_without_pk REPLICA IDENTITY DEFAULT;
ALTER TABLE table_with_unique REPLICA IDENTITY FULL;
DELETE FROM table_with_unique WHERE b = 1;
ALTER TABLE table_with_unique REPLICA IDENTITY DEFAULT;
SELECT data FROM slot_get('include-empty-xacts', '1');
data
{
	"tx": [
	]
}
{
	"tx": [
		{
			"op": "D",
			"schema": "public",
			"table": "table_with_pk",
			"keynames": ["a", "b", "c", "d", "e", "f", "g", "h", "i", "j", "k", "l", "m", "n", "o", "p"],
			"keytypes": ["int2", "int2", "int4", "int8", "numeric", "float4", "float8", "bpchar", "varchar", "text", "varbit", "timestamp", "date", "bool", "json", "tsvector"],
			"oldkey": [1, 1, 2, 3, "3.540", 876.563, 1.23, "teste     ", "testando", "um texto longo", "001110010101010", "Sat Nov 02 17:30:52 2013", "02-04-2013", true, "{ \"a\": 123 }", "'Old' 'Parr'"]
		}
	]
}
{
	"tx": [
		{
			"op": "D",
			"schema": "public",
			"table": "table_with_pk",
			"oldkey": [2, 4, 5, 6, "3.540", 876.563, 1.23, "teste     ", "testando", "um texto longo", "001110010101010", "Sat Nov 02 17:30:52 2013", "02-04-2013", true, "{ \"a\": 123 }", "'Old' 'Parr'"]
		}
	]
}
{
	"tx": [
	]
}
{
	"tx": [
	]
}
{
	"tx": [
		{
			"op": "D",
			"schema": "public",
			"table": "table_without_pk",
			"keynames": ["a", "b", "c", "d", "e", "f", "g", "h", "i", "j", "k", "l", "m", "n", "o", "p"],
			"keytypes": ["int2", "int2", "int4", "int8", "numeric", "float4", "float8", "bpchar", "varchar", "text", "varbit", "timestamp", "date", "bool", "json", "tsvector"],
			"oldkey": [1, 1, 2, 3, "3.540", 876.563, 1.23, "teste     ", "testando", "um texto longo", "001110010101010", "Sat Nov 02 17:30:52 2013", "02-04-2013", true, "{ \"a\": 123 }", "'Old' 'Parr'"]
		}
	]
}
{
	"tx": [
	]
}
{
	"tx": [
	]
}
{
	"tx": [
		{
			"op": "D",
			"schema": "public",
			"table": "table_with_unique",
			"keynames": ["a", "b", "c", "d", "e", "f", "g", "h", "i", "j", "k", "l", "m", "n", "o", "p"],
			"keytypes": ["int2", "int2", "int4", "int8", "numeric", "float4", "float8", "bpchar", "varchar", "text", "varbit", "timestamp", "date", "bool", "json", "tsvector"],
			"oldkey": [1, 1, 2, 3, "3.540", 876.563, 1.23, "teste     ", "testando", "um texto longo", "001110010101010", "Sat Nov 02 17:30:52 2013", "02-04-2013", true, "{ \"a\": 123 }", "'Old' 'Parr'"]
		}
	]
}
{
	"tx": [
	]
}
(10 rows)
-- Test skipping empty xacts
SELECT slot_drop();
slot_drop
stop
(1 row)
INSERT INTO table_with_pk (b, c, d, e, f, g, h, i, j, k, l, m, n, o, p) VALUES(1, 2, 3, 3.54, 876.563452345, 1.23, 'teste', 'testando', 'um texto longo', B'001110010101010', '2013-11-02 17:30:52', '2013-02-04', true, '{ "a": 123 }', 'Old Old Parr'::tsvector);
INSERT INTO table_with_pk (b, c, d, e, f, g, h, i, j, k, l, m, n, o, p) VALUES(4, 5, 6, 3.54, 876.563452345, 1.23, 'teste', 'testando', 'um texto longo', B'001110010101010', '2013-11-02 17:30:52', '2013-02-04', true, '{ "a": 123 }', 'Old Old Parr'::tsvector);
INSERT INTO table_without_pk (b, c, d, e, f, g, h, i, j, k, l, m, n, o, p) VALUES(1, 2, 3, 3.54, 876.563452345, 1.23, 'teste', 'testando', 'um texto longo', B'001110010101010', '2013-11-02 17:30:52', '2013-02-04', true, '{ "a": 123 }', 'Old Old Parr'::tsvector);
INSERT INTO table_with_unique (b, c, d, e, f, g, h, i, j, k, l, m, n, o, p) VALUES(1, 2, 3, 3.54, 876.563452345, 1.23, 'teste', 'testando', 'um texto longo', B'001110010101010', '2013-11-02 17:30:52', '2013-02-04', true, '{ "a": 123 }', 'Old Old Parr'::tsvector);
SELECT slot_create();
slot_create
init
(1 row)
-- DELETE: REPLICA IDENTITY FULL
ALTER TABLE table_with_pk REPLICA IDENTITY FULL;
DELETE FROM table_with_pk WHERE b = 1;
DELETE FROM table_with_pk WHERE n = true;
ALTER TABLE table_with_pk REPLICA IDENTITY DEFAULT;
ALTER TABLE table_without_pk REPLICA IDENTITY FULL;
DELETE FROM table_without_pk WHERE b = 1;
ALTER TABLE table_without_pk REPLICA IDENTITY DEFAULT;
ALTER TABLE table_with_unique REPLICA IDENTITY FULL;
DELETE FROM table_with_unique WHERE b = 1;
ALTER TABLE table_with_unique REPLICA IDENTITY DEFAULT;
SELECT data FROM slot_get();
data
{
	"tx": [
		{
			"op": "D",
			"schema": "public",
			"table": "table_with_pk",
			"keynames": ["a", "b", "c", "d", "e", "f", "g", "h", "i", "j", "k", "l", "m", "n", "o", "p"],
			"keytypes": ["int2", "int2", "int4", "int8", "numeric", "float4", "float8", "bpchar", "varchar", "text", "varbit", "timestamp", "date", "bool", "json", "tsvector"],
			"oldkey": [3, 1, 2, 3, "3.540", 876.563, 1.23, "teste     ", "testando", "um texto longo", "001110010101010", "Sat Nov 02 17:30:52 2013", "02-04-2013", true, "{ \"a\": 123 }", "'Old' 'Parr'"]
		}
	]
}
{
	"tx": [
		{
			"op": "D",
			"schema": "public",
			"table": "table_with_pk",
			"oldkey": [4, 4, 5, 6, "3.540", 876.563, 1.23, "teste     ", "testando", "um texto longo", "001110010101010", "Sat Nov 02 17:30:52 2013", "02-04-2013", true, "{ \"a\": 123 }", "'Old' 'Parr'"]
		}
	]
}
{
	"tx": [
		{
			"op": "D",
			"schema": "public",
			"table": "table_without_pk",
			"keynames": ["a", "b", "c", "d", "e", "f", "g", "h", "i", "j", "k", "l", "m", "n", "o", "p"],
			"keytypes": ["int2", "int2", "int4", "int8", "numeric", "float4", "float8", "bpchar", "varchar", "text", "varbit", "timestamp", "date", "bool", "json", "tsvector"],
			"oldkey": [2, 1, 2, 3, "3.540", 876.563, 1.23, "teste     ", "testando", "um texto longo", "001110010101010", "Sat Nov 02 17:30:52 2013", "02-04-2013", true, "{ \"a\": 123 }", "'Old' 'Parr'"]
		}
	]
}
{
	"tx": [
		{
			"op": "D",
			"schema": "public",
			"table": "table_with_unique",
			"keynames": ["a", "b", "c", "d", "e", "f", "g", "h", "i", "j", "k", "l", "m", "n", "o", "p"],
			"keytypes": ["int2", "int2", "int4", "int8", "numeric", "float4", "float8", "bpchar", "varchar", "text", "varbit", "timestamp", "date", "bool", "json", "tsvector"],
			"oldkey": [2, 1, 2, 3, "3.540", 876.563, 1.23, "teste     ", "testando", "um texto longo", "001110010101010", "Sat Nov 02 17:30:52 2013", "02-04-2013", true, "{ \"a\": 123 }", "'Old' 'Parr'"]
		}
	]
}
(4 rows)
SELECT slot_drop();
slot_drop
stop
(1 row)
