\set VERBOSITY terse
\pset format unaligned
-- predictability
SET synchronous_commit = on;
DROP TABLE IF EXISTS t1;
NOTICE:  table "t1" does not exist, skipping
DROP TABLE IF EXISTS t2;
NOTICE:  table "t2" does not exist, skipping
DROP TABLE IF EXISTS t3;
NOTICE:  table "t3" does not exist, skipping
CREATE TABLE t1 (id int PRIMARY KEY);
CREATE TABLE t2 (id int PRIMARY KEY);
CREATE TABLE t3 (id int PRIMARY KEY);
CREATE TABLE s1 (id int PRIMARY KEY);
SELECT slot_create();
slot_create
init
(1 row)
-- Include commands in single tables
insert into t1 values (1);
insert into t2 values (2);
insert into t3 values (3);
update t1 set id = 10 where id = 1;
update t2 set id = 20 where id = 2;
update t3 set id = 30 where id = 3;
delete from t1 where id = 10;
delete from t2 where id = 20;
delete from t3 where id = 30;
SELECT data FROM slot_get(
	'include', '{"table": "t1"}', 'include', '{"table": "t3"}');
data
{
	"tx": [
		{
			"op": "I",
			"schema": "public",
			"table": "t1",
			"colnames": ["id"],
			"coltypes": ["int4"],
			"values": [1]
		}
	]
}
{
	"tx": [
		{
			"op": "I",
			"schema": "public",
			"table": "t3",
			"colnames": ["id"],
			"coltypes": ["int4"],
			"values": [3]
		}
	]
}
{
	"tx": [
		{
			"op": "U",
			"schema": "public",
			"table": "t1",
			"values": [10],
			"keynames": ["id"],
			"keytypes": ["int4"],
			"oldkey": [1]
		}
	]
}
{
	"tx": [
		{
			"op": "U",
			"schema": "public",
			"table": "t3",
			"values": [30],
			"keynames": ["id"],
			"keytypes": ["int4"],
			"oldkey": [3]
		}
	]
}
{
	"tx": [
		{
			"op": "D",
			"schema": "public",
			"table": "t1",
			"oldkey": [10]
		}
	]
}
{
	"tx": [
		{
			"op": "D",
			"schema": "public",
			"table": "t3",
			"oldkey": [30]
		}
	]
}
(6 rows)
-- Include commands on a pattern of tables
insert into t1 values (1);
insert into t2 values (2);
insert into s1 values (3);
SELECT data FROM slot_get(
	'include', '{"tables": "t"}');
data
{
	"tx": [
		{
			"op": "I",
			"schema": "public",
			"table": "t1",
			"colnames": ["id"],
			"coltypes": ["int4"],
			"values": [1]
		}
	]
}
{
	"tx": [
		{
			"op": "I",
			"schema": "public",
			"table": "t2",
			"colnames": ["id"],
			"coltypes": ["int4"],
			"values": [2]
		}
	]
}
(2 rows)
insert into t1 values (4);
insert into t2 values (5);
insert into s1 values (6);
SELECT data FROM slot_get(
	'include', '{"tables": "^.1$"}');
data
{
	"tx": [
		{
			"op": "I",
			"schema": "public",
			"table": "t1",
			"colnames": ["id"],
			"coltypes": ["int4"],
			"values": [4]
		}
	]
}
{
	"tx": [
		{
			"op": "I",
			"schema": "public",
			"table": "s1",
			"colnames": ["id"],
			"coltypes": ["int4"],
			"values": [6]
		}
	]
}
(2 rows)
-- Exclude a table after inclusion
insert into t1 values (7);
insert into t2 values (8);
insert into t3 values (9);
insert into s1 values (10);
SELECT data FROM slot_get(
	'include', '{"tables": "^t"}', 'exclude', '{"table": "t2"}');
data
{
	"tx": [
		{
			"op": "I",
			"schema": "public",
			"table": "t1",
			"colnames": ["id"],
			"coltypes": ["int4"],
			"values": [7]
		}
	]
}
{
	"tx": [
		{
			"op": "I",
			"schema": "public",
			"table": "t3",
			"colnames": ["id"],
			"coltypes": ["int4"],
			"values": [9]
		}
	]
}
(2 rows)
-- Exclude a single table
insert into t1 values (11);
insert into t2 values (12);
insert into t3 values (13);
SELECT data FROM slot_get(
	'exclude', '{"table": "t2"}');
data
{
	"tx": [
		{
			"op": "I",
			"schema": "public",
			"table": "t1",
			"colnames": ["id"],
			"coltypes": ["int4"],
			"values": [11]
		}
	]
}
{
	"tx": [
		{
			"op": "I",
			"schema": "public",
			"table": "t3",
			"colnames": ["id"],
			"coltypes": ["int4"],
			"values": [13]
		}
	]
}
(2 rows)
-- Exclude a pattern
insert into t1 values (14);
insert into t2 values (15);
insert into t3 values (16);
insert into s1 values (17);
SELECT data FROM slot_get(
	'exclude', '{"tables": ".1"}');
data
{
	"tx": [
		{
			"op": "I",
			"schema": "public",
			"table": "t2",
			"colnames": ["id"],
			"coltypes": ["int4"],
			"values": [15]
		}
	]
}
{
	"tx": [
		{
			"op": "I",
			"schema": "public",
			"table": "t3",
			"colnames": ["id"],
			"coltypes": ["int4"],
			"values": [16]
		}
	]
}
(2 rows)
-- Include after exclusion
insert into t1 values (18);
insert into t2 values (19);
insert into t3 values (20);
insert into s1 values (21);
SELECT data FROM slot_get(
	'exclude', '{"tables": "t"}', 'include', '{"tables": ".2"}');
data
{
	"tx": [
		{
			"op": "I",
			"schema": "public",
			"table": "t2",
			"colnames": ["id"],
			"coltypes": ["int4"],
			"values": [19]
		}
	]
}
{
	"tx": [
		{
			"op": "I",
			"schema": "public",
			"table": "s1",
			"colnames": ["id"],
			"coltypes": ["int4"],
			"values": [21]
		}
	]
}
(2 rows)
-- Include specific column
CREATE TABLE tc1 (id int PRIMARY KEY, foo text, bar text);
CREATE TABLE tc2 (id int PRIMARY KEY, foo text, bar text);
-- Columns must be an array
SELECT data FROM slot_get(
	'include', '{"table": "tc1", "columns": 42}');
ERROR:  member "columns" must be a json array, in "{"table": "tc1", "columns": 42}"
-- Test including and excluding columns
INSERT INTO tc1 VALUES (1, 'v1', 'v2'), (2, 'v3', 'v4');
UPDATE tc1 SET foo = 'v5' WHERE id = 1;
DELETE FROM tc1 WHERE id = 2;
SELECT data FROM slot_peek(
	'include', '{"table": "tc1", "columns": ["id", "bar", "qux"]}');
data
{
	"tx": [
		{
			"op": "I",
			"schema": "public",
			"table": "tc1",
			"colnames": ["id", "bar"],
			"coltypes": ["int4", "text"],
			"values": [1, "v2"]
		}
		,{
			"op": "I",
			"schema": "public",
			"table": "tc1",
			"values": [2, "v4"]
		}
	]
}
{
	"tx": [
		{
			"op": "U",
			"schema": "public",
			"table": "tc1",
			"values": [1, "v2"],
			"keynames": ["id"],
			"keytypes": ["int4"],
			"oldkey": [1]
		}
	]
}
{
	"tx": [
		{
			"op": "D",
			"schema": "public",
			"table": "tc1",
			"oldkey": [2]
		}
	]
}
(3 rows)
SELECT data FROM slot_get(
	'include', '{"table": "tc1", "skip_columns": ["bar", "qux"]}');
data
{
	"tx": [
		{
			"op": "I",
			"schema": "public",
			"table": "tc1",
			"colnames": ["id", "foo"],
			"coltypes": ["int4", "text"],
			"values": [1, "v1"]
		}
		,{
			"op": "I",
			"schema": "public",
			"table": "tc1",
			"values": [2, "v3"]
		}
	]
}
{
	"tx": [
		{
			"op": "U",
			"schema": "public",
			"table": "tc1",
			"values": [1, "v5"],
			"keynames": ["id"],
			"keytypes": ["int4"],
			"oldkey": [1]
		}
	]
}
{
	"tx": [
		{
			"op": "D",
			"schema": "public",
			"table": "tc1",
			"oldkey": [2]
		}
	]
}
(3 rows)
-- Later include config overrides previous
INSERT INTO tc1 VALUES (3, 'v1', 'v2');
INSERT INTO tc2 VALUES (4, 'v3', 'v4');
SELECT data FROM slot_peek(
	'include', '{"tables": "^tc", "columns": ["id", "foo"]}');
data
{
	"tx": [
		{
			"op": "I",
			"schema": "public",
			"table": "tc1",
			"colnames": ["id", "foo"],
			"coltypes": ["int4", "text"],
			"values": [3, "v1"]
		}
	]
}
{
	"tx": [
		{
			"op": "I",
			"schema": "public",
			"table": "tc2",
			"colnames": ["id", "foo"],
			"coltypes": ["int4", "text"],
			"values": [4, "v3"]
		}
	]
}
(2 rows)
SELECT data FROM slot_get(
	'include', '{"tables": "^tc", "columns": ["id", "foo"]}',
	'include', '{"table": "tc1", "columns": ["id", "bar"]}');
data
{
	"tx": [
		{
			"op": "I",
			"schema": "public",
			"table": "tc1",
			"colnames": ["id", "bar"],
			"coltypes": ["int4", "text"],
			"values": [3, "v2"]
		}
	]
}
{
	"tx": [
		{
			"op": "I",
			"schema": "public",
			"table": "tc2",
			"colnames": ["id", "foo"],
			"coltypes": ["int4", "text"],
			"values": [4, "v3"]
		}
	]
}
(2 rows)
-- Alter table kicks in new columns
INSERT INTO tc1 VALUES (4, 'v1', 'v2');
ALTER TABLE tc1 ADD qux text;
INSERT INTO tc1 VALUES (5, 'v2', 'v3', 'v4');
ALTER TABLE tc1 DROP qux;
SELECT data FROM slot_get(
	'include', '{"table": "tc1", "columns": ["id", "foo", "qux"]}');
data
{
	"tx": [
		{
			"op": "I",
			"schema": "public",
			"table": "tc1",
			"colnames": ["id", "foo"],
			"coltypes": ["int4", "text"],
			"values": [4, "v1"]
		}
	]
}
{
	"tx": [
		{
			"op": "I",
			"schema": "public",
			"table": "tc1",
			"colnames": ["id", "foo", "qux"],
			"coltypes": ["int4", "text", "text"],
			"values": [5, "v2", "v4"]
		}
	]
}
(2 rows)
SELECT slot_drop();
slot_drop
stop
(1 row)
